{
  "schemaVersion": "pracmo-learning-track@v1",
  "clientRequestId": "walking-practice-20260814-v2",
  "track": {
    "title": "散步起步练习甲程",
    "description": "用一道判断练习和一个日常行动，建立可持续的散步节奏。",
    "category": "fitness",
    "goalStatement": "从安全起步开始，形成稳定散步习惯",
    "goalReason": "减少久坐，以可完成的小步逐渐增加日常活动量"
  },
  "path": {
    "currentStateKey": "current",
    "targetStateKey": "target",
    "states": [
      {
        "stateKey": "current",
        "title": "尚未稳定开始",
        "description": "散步次数少，容易一开始安排过量。",
        "criteria": [
          {"criterionId": "current-1", "description": "一周散步少于两次"}
        ]
      },
      {
        "stateKey": "target",
        "title": "形成轻量节奏",
        "description": "能按自己的身体反馈稳定完成轻量散步。",
        "criteria": [
          {"criterionId": "target-1", "description": "连续四周每周散步至少四次"}
        ]
      }
    ]
  },
  "concepts": [
    {"conceptKey": "walking-load", "name": "循序增加步行负荷"}
  ],
  "exercises": [
    {
      "exerciseKey": "warmup-check",
      "title": "散步起步判断",
      "userRequest": "识别适合自己的起步强度",
      "difficultyLevel": 2,
      "allowQuestionTypes": ["single_choice"],
      "questions": [
        {
          "questionType": "single_choice",
          "questionContent": "刚开始恢复散步时，更稳妥的做法是什么？",
          "explanation": "从可完成的小步开始，观察身体反馈后再逐渐增加。",
          "difficultyScore": 2,
          "bloomLevel": 2,
          "conceptKey": "walking-load",
          "testableClaim": "起步负荷应循序增加",
          "options": [
            {"content": "从短时间开始并观察反应", "isCorrect": true, "explanation": "便于建立可持续节奏。"},
            {"content": "第一天就走到力竭", "isCorrect": false, "explanation": "过量更容易中断计划。"}
          ]
        }
      ],
      "stateLink": {
        "stateKey": "target",
        "relationRole": "advance",
        "criterionIds": ["target-1"],
        "whyNow": "先理解安全起步，再开始行动。"
      }
    }
  ],
  "actions": [
    {
      "actionKey": "daily-walk",
      "title": "晚饭后轻松散步",
      "description": "按当天状态完成一段轻松散步。",
      "iconCode": "walk",
      "colorCode": "green",
      "scheduleType": "daily",
      "scheduleConfigJson": "{}",
      "timezone": "Asia/Shanghai",
      "startDate": "2026-08-15",
      "deadlineLocalTime": "20:30",
      "gracePolicy": "two_hours",
      "completionMode": "one_tap",
      "reminderConfigJson": "",
      "contentMode": "self_directed",
      "stateLink": {
        "stateKey": "target",
        "relationRole": "advance",
        "criterionIds": ["target-1"],
        "whyNow": "通过每日小步积累稳定次数。"
      }
    }
  ],
  "assets": [],
  "metadata": {"language": "zh-CN", "sourceType": "pracmo_create_e2e"}
}
