{
  "schemaVersion": "pracmo-learning-track@v1",
  "clientRequestId": "walking-habit-20260814-v1",
  "track": {
    "title": "把散步变成稳定习惯",
    "description": "从偶尔出门到每周稳定散步。",
    "category": "fitness",
    "goalStatement": "连续四周每周至少散步四次",
    "goalReason": "改善久坐状态并获得可持续的日常活动节奏"
  },
  "path": {
    "currentStateKey": "current",
    "targetStateKey": "target",
    "states": [
      {
        "stateKey": "current",
        "title": "偶尔散步",
        "description": "尚未形成稳定节奏",
        "criteria": [{"criterionId": "current-1", "description": "一周散步少于两次"}]
      },
      {
        "stateKey": "target",
        "title": "稳定散步",
        "description": "能够按计划持续散步",
        "criteria": [{"criterionId": "target-1", "description": "连续四周每周散步至少四次"}]
      }
    ]
  },
  "concepts": [],
  "exercises": [],
  "actions": [],
  "assets": [],
  "metadata": {"language": "zh-CN", "sourceType": "pracmo_create"}
}
